{
  "schema_id": "urn:dosai:schema:acceptance-test-catalog:5",
  "schema_version": 5,
  "message_id": "709d5f23-2040-47d2-b66c-b028168908ec",
  "created_at": "2026-08-01T01:55:00.000Z",
  "producer": "dosai.governance",
  "producer_generation": "5",
  "trace_id": "19b40db5-02f4-49b9-80c4-648572d18bad",
  "data_class": "D5",
  "catalog_id": "60eab5aa-4364-42e2-968e-cda443065bf0",
  "catalog_version": 5,
  "predecessor_catalog": {
    "path": "docs/testing/acceptance-test-catalog-v4.json",
    "version": 4,
    "sha256": "5339a14ddad7b79a127378b047e884b3ff3602659482b6029146bb1ab86b20ad"
  },
  "implementation_manifest": "docs/testing/acceptance-catalog-v4-to-v5-implementation.json",
  "status": "ACCEPTED",
  "platform_profiles": ["MACOS_ARM64_V1"],
  "runner_contract": {
    "executable": "pnpm",
    "fixed_args": ["exec", "dosai-acceptance", "run", "--catalog", "docs/testing/acceptance-test-catalog-v5.json"],
    "suite_arg": "--suite",
    "report_dir_arg": "--report-dir-env",
    "report_dir_env": "DOSAI_EVIDENCE_DIR",
    "shell": false,
    "report_schema_id": "urn:dosai:schema:evidence-report:5"
  },
  "gate_pass_conditions": ["ALL_REQUIRED_SCENARIOS_PASS", "NO_PROHIBITED_DATA", "NO_UNKNOWN_OUTCOME", "CLEANUP_VERIFIED", "REPORT_SCHEMA_VALID", "ARTIFACTS_VERIFIED", "NO_UNAPPROVED_EFFECT"],
  "suites": [
    {
      "id": "P0-AT-001", "phase": "P0", "title": "Governing authority and status consistency", "test_types": ["REVIEW", "SECURITY", "NEGATIVE"], "controls": ["F01", "F12"], "capabilities": [], "requirement_ids": ["P0.1", "P0.2", "P0.3", "P0.4", "P0.5"], "fixture_manifest": "tests/acceptance/manifests/p0-at-001.json",
      "scenarios": [{"id": "P0-AT-001-S01", "mode": "REVIEW", "requirement": "Resolve document precedence and verify every owner-approved baseline has synchronized Accepted status and timestamp."}, {"id": "P0-AT-001-S02", "mode": "NEGATIVE", "requirement": "Inject conflicting status, authority, or phase-order fixtures and require deterministic failure without modifying source documents."}],
      "required_artifacts": ["REPORT", "ASSERTIONS", "ENVIRONMENT", "COMMAND", "MANIFEST", "CLEANUP"], "timeout_seconds": 120, "required_for_gate": true, "implementation_state": "NOT_IMPLEMENTED"
    },
    {
      "id": "P0-AT-002", "phase": "P0", "title": "Schema registry and contract integrity", "test_types": ["POSITIVE", "NEGATIVE", "SECURITY"], "controls": ["F01", "F03", "F12"], "capabilities": [], "requirement_ids": ["P0.5", "P0.6"], "fixture_manifest": "tests/acceptance/manifests/p0-at-002.json",
      "scenarios": [{"id": "P0-AT-002-S01", "mode": "POSITIVE", "requirement": "Validate every defined schema against the pinned dialect, resolve every reference, and verify registry identity, version, path, and immutable predecessor."}, {"id": "P0-AT-002-S02", "mode": "NEGATIVE", "requirement": "Reject unknown versions, duplicate keys, unresolved references, extra fields, invalid UTF-8, negative zero, and mismatched registry identities."}],
      "required_artifacts": ["REPORT", "ASSERTIONS", "ENVIRONMENT", "COMMAND", "MANIFEST", "CLEANUP"], "timeout_seconds": 180, "required_for_gate": true, "implementation_state": "NOT_IMPLEMENTED"
    },
    {
      "id": "P0-AT-003", "phase": "P0", "title": "Control coverage, capability non-claims, and production absence", "test_types": ["REVIEW", "NEGATIVE", "SECURITY"], "controls": ["F01", "F02", "F03", "F04", "F05", "F06", "F07", "F08", "F09", "F10", "F11", "F12"], "capabilities": [], "requirement_ids": ["P0.EXIT", "SECURITY.PHASE0"], "fixture_manifest": "tests/acceptance/manifests/p0-at-003.json",
      "scenarios": [{"id": "P0-AT-003-S01", "mode": "REVIEW", "requirement": "Map every Critical and High control to planned work and proof while every unproven capability remains UNVERIFIED with a fallback."}, {"id": "P0-AT-003-S02", "mode": "SECURITY", "requirement": "Verify production credentials, endpoints, deployment, Stripe Live, default-branch mutation, telemetry upload, and undocumented integrations are absent or prohibited."}],
      "required_artifacts": ["REPORT", "ASSERTIONS", "ENVIRONMENT", "COMMAND", "MANIFEST", "CLEANUP"], "timeout_seconds": 180, "required_for_gate": true, "implementation_state": "NOT_IMPLEMENTED"
    },
    {
      "id": "P1-AT-001", "phase": "P1", "title": "Packaged shell boot and platform profile", "test_types": ["POSITIVE", "PACKAGING", "RECOVERY"], "controls": ["F01", "F05"], "capabilities": ["electron.typed_bridge"], "requirement_ids": ["P1.1", "P1.2", "P1.EXIT"], "fixture_manifest": "tests/acceptance/manifests/p1-at-001-v3.json",
      "scenarios": [{"id": "P1-AT-001-S01", "mode": "PACKAGING", "requirement": "Build, launch, quit, and relaunch a clean package on the current registered MACOS_ARM64_V1 development host with pinned runtime versions and verified macOS 15.0 package metadata."}, {"id": "P1-AT-001-S02", "mode": "RECOVERY", "requirement": "Recover from renderer and unclean application termination while proving worker and execution authority remain absent and no unmanaged state persists."}],
      "required_artifacts": ["REPORT", "ASSERTIONS", "ENVIRONMENT", "COMMAND", "PACKAGE", "MANIFEST", "CLEANUP"], "timeout_seconds": 1200, "required_for_gate": true, "implementation_state": "IMPLEMENTED"
    },
    {
      "id": "P1-AT-002", "phase": "P1", "title": "Renderer, preload, and main privilege boundaries", "test_types": ["NEGATIVE", "SECURITY"], "controls": ["F01", "F04"], "capabilities": ["electron.typed_bridge"], "requirement_ids": ["P1.2", "P1.3", "P1.4", "I02", "I03"], "fixture_manifest": "tests/acceptance/manifests/p1-at-002-v3.json",
      "scenarios": [{"id": "P1-AT-002-S01", "mode": "SECURITY", "requirement": "Prove sandboxing, context isolation, disabled Node integration, CSP, navigation denial, sender validation, and narrow typed preload methods in the packaged app."}, {"id": "P1-AT-002-S02", "mode": "NEGATIVE", "requirement": "Reject generic IPC, raw process, filesystem, database, credential, debugger, and arbitrary message access from renderer and preload compromise fixtures."}],
      "required_artifacts": ["REPORT", "ASSERTIONS", "ENVIRONMENT", "COMMAND", "PACKAGE", "MANIFEST", "CLEANUP"], "timeout_seconds": 900, "required_for_gate": true, "implementation_state": "IMPLEMENTED"
    },
    {
      "id": "P1-AT-003", "phase": "P1", "title": "IPC rejection, navigation safety, and main-loop responsiveness", "test_types": ["NEGATIVE", "FAULT", "LOAD", "PERFORMANCE"], "controls": ["F01", "F05"], "capabilities": ["electron.typed_bridge"], "requirement_ids": ["P1.3", "P1.4", "T04", "T07"], "fixture_manifest": "tests/acceptance/manifests/p1-at-003-v3.json",
      "scenarios": [{"id": "P1-AT-003-S01", "mode": "NEGATIVE", "requirement": "Reject malformed, oversized, duplicate, unknown, stale, cross-window, subframe, navigation, permission, and external-protocol requests without side effects."}, {"id": "P1-AT-003-S02", "mode": "LOAD", "requirement": "Saturate the fixed read-only typed bridge while renderer and main loops remain responsive, the shell remains reachable, and worker, execution, and trusted-stop authority remain absent."}],
      "required_artifacts": ["REPORT", "ASSERTIONS", "ENVIRONMENT", "COMMAND", "PERFORMANCE", "CLEANUP"], "timeout_seconds": 1200, "required_for_gate": true, "implementation_state": "IMPLEMENTED"
    },
    {
      "id": "P2-AT-001", "phase": "P2", "title": "Typed operation normalization and tier policy", "test_types": ["POSITIVE", "NEGATIVE", "SECURITY"], "controls": ["F01", "F02", "F07"], "capabilities": ["policy.preflight"], "requirement_ids": ["P2.1", "P2.2", "I01", "I03"], "fixture_manifest": "tests/acceptance/manifests/p2-at-001-v3.json",
      "scenarios": [{"id": "P2-AT-001-S01", "mode": "POSITIVE", "requirement": "Classify complete typed Green, Yellow, Red, and Black synthetic plans from exact actor, target, environment, capability, data, and effect fields."}, {"id": "P2-AT-001-S02", "mode": "NEGATIVE", "requirement": "Reject unknown schemas, generic command strings, label spoofing, capability expansion, omitted effects, production targets, and every attempted tier downgrade."}],
      "required_artifacts": ["REPORT", "ASSERTIONS", "ENVIRONMENT", "COMMAND", "MANIFEST", "JOURNAL", "CLEANUP"], "timeout_seconds": 600, "required_for_gate": true, "implementation_state": "IMPLEMENTED"
    },
    {
      "id": "P2-AT-002", "phase": "P2", "title": "Approval, action-plan binding, and single-use grants", "test_types": ["POSITIVE", "NEGATIVE", "SECURITY", "FAULT"], "controls": ["F01", "F07"], "capabilities": ["approval.local", "policy.preflight"], "requirement_ids": ["P2.1", "P2.4", "P2.5", "I08"], "fixture_manifest": "tests/acceptance/manifests/p2-at-002-v3.json",
      "scenarios": [{"id": "P2-AT-002-S01", "mode": "POSITIVE", "requirement": "Bind fresh trusted owner approval and one short-lived single-use grant to the exact immutable Red action plan and current policy."}, {"id": "P2-AT-002-S02", "mode": "NEGATIVE", "requirement": "Deny stale, replayed, forged, expired, reused, cross-session, changed-target, changed-evidence, self-approved, and Black-tier grant attempts."}],
      "required_artifacts": ["REPORT", "ASSERTIONS", "ENVIRONMENT", "COMMAND", "JOURNAL", "MANIFEST", "CLEANUP"], "timeout_seconds": 900, "required_for_gate": true, "implementation_state": "IMPLEMENTED"
    },
    {
      "id": "P2-AT-003", "phase": "P2", "title": "Audit durability, keys, continuity, and degraded safety", "test_types": ["SECURITY", "FAULT", "RECOVERY"], "controls": ["F01", "F05", "F12"], "capabilities": ["policy.preflight", "safety.emergency_stop"], "requirement_ids": ["P2.3", "P2.4", "I11", "I12", "I13"], "fixture_manifest": "tests/acceptance/manifests/p2-at-003-v3.json",